{
  "schema_version": "1.0.0",
  "instance_id": "demo-local-research",
  "name": "Built-in practice research, not yet executed",
  "template_id": "research-starter",
  "template_version": "0.1.0",
  "template_lock": "template-lock.json",
  "current_graph_revision": "g0001",
  "parameters": {
    "question": "How can we compare three fictional software products using clearly identified evidence?",
    "scope": "Practice only; no external accounts or real customers"
  },
  "policy": {
    "autonomy": "bounded",
    "allowed_actions": [
      "read",
      "research",
      "write_local",
      "review"
    ],
    "human_required_actions": [
      "stage_paused",
      "activate_live",
      "change_budget",
      "deploy_prod",
      "send_message",
      "emit_conversion"
    ],
    "default_gates": [
      "evidence-self-check"
    ],
    "max_parallel_tasks": 1,
    "allow_dynamic_children": false
  },
  "created_at": "2026-10-20T12:00:00Z",
  "created_by": {
    "agent": "aos-w",
    "platform": "ChatGPT",
    "role": "scaffold-author",
    "instance": "prompt-09"
  }
}
